{
  "metadata": {
    "title": "Web3 Renewables Granular Certificate Index",
    "description": "Index describing the location of all GCs reporting into the Web3 Renewables Index",
    "document_type": "Development",
    "web3_renewables_did": "did:ethr:volta:0x224CbA4ae8D27Ba69793CFeFe042682B81eA77c5",
    "version": 1
  },
  "pvSystems": {
    "did:ethr:volta:0xDE859DE701CF59Ca8Fe0a3381B946820f85E0C54": {
      "reporting_dates": [
        "2022-08-01T00:00:00.000Z",
        "2022-08-02T00:00:00.000Z"
      ],
      "status": "Revoked"
    }
  },
  "daily": {
    "2022-08-01T00:00:00.000Z": {
      "entries": [
        {
          "rawInverterCID": "bafybeifmwxojwausy43ajkls44y54eqan6vmz6dxhrd6pwaomhunrz7e4y",
          "vcUuid": "none",
          "cid": "bafybeicpikgrwzpieeofti6qwyx2udemzilpbply2yfkvahcnbmoaxo75m",
          "fileName": "2022-08-01T00:00:00.000Z_did:ethr:volta:0xDE859DE701CF59Ca8Fe0a3381B946820f85E0C54_gc.json",
          "pvSystemDID": "did:ethr:volta:0xDE859DE701CF59Ca8Fe0a3381B946820f85E0C54"
        }
      ]
    },
    "2022-08-02T00:00:00.000Z": {
      "entries": [
        {
          "rawInverterCID": "bafybeifmwxojwausy43ajkls44y54eqan6vmz6dxhrd6pwaomhunrz7e4y",
          "vcUuid": "none",
          "cid": "bafybeicpikgrwzpieeofti6qwyx2udemzilpbply2yfkvahcnbmoaxo75m",
          "fileName": "2022-08-02T00:00:00.000Z_did:ethr:volta:0xDE859DE701CF59Ca8Fe0a3381B946820f85E0C54_gc.json",
          "pvSystemDID": "did:ethr:volta:0xDE859DE701CF59Ca8Fe0a3381B946820f85E0C54"
        }
      ]
    }
  },
  "monthly": {
    "2022": {
      "8": {
        "entries": [
          {
            "vcUuid": "53834e7f-5efb-433a-9556-30c710cd126e",
            "cid": "bafybeidsp4psp5lkfguv3vk6vvxekckslyevc67vv3gxnx5krpcclmqqrq",
            "fileName": "2022-8-1_did:ethr:volta:0xDE859DE701CF59Ca8Fe0a3381B946820f85E0C54_gc.json",
            "pvSystemDID": "did:ethr:volta:0xDE859DE701CF59Ca8Fe0a3381B946820f85E0C54"
          }
        ]
      }
    }
  }
}